{"activation":"public_interest_or_inequality_piece","adapter_version":"1.0.0","adjudications":[],"artifact":{"byte_length":549,"path":"milestones/M1_project_memo.md","sha256":"a0df579be3f460b17c872cfd15fc10938e1c7dda0d66b57586e760e35fd92908"},"created_at":"2026-07-26T00:00:00Z","diagnostic_only":false,"execution_status":"completed","findings":[],"legacy_execution_evidence":{"evidence":[{"byte_length":50,"path":"reviews/.harness/draft-governance/m1-initial-evaluation/non-graph-evidence.txt","sha256":"e8955d608e8c537dfd835bb9b37e713c449cfe15a1c47142f4f4b2a68ce60ab9"}],"rationale":"The fixture adapter executed; this does not substitute for its clean outcome.","status":"applied"},"obligation_id":"public-interest-register","outcome":"clean","policy":{"byte_length":32987,"path":"reviews/.harness/draft-governance/m1-initial-evaluation/contract.json","sha256":"33a6329b097ae178d727ac47ab296d4c023766440981e1524b477b4512713089"},"report":{"byte_length":691,"path":"reviews/.harness/obligation-reports/evaluation/public-interest-register.json","sha256":"8ba85df74719d4da41592e130ef216c439b92c991640fa9762644e1a36913ae6"},"schema_version":"1.0.0","verifier_receipt":{"byte_length":525,"path":"reviews/.harness/obligation-authority/obligation_verifier_authority-d16d26634e063ffd.json","sha256":"f99da2a4245fa1ee694f90666397fc24bb22d618e35115c9dd2bee8c1c4c7895"}}
