{"activation":"always","adapter_version":"1.0.0","adjudications":[],"artifact":{"byte_length":549,"path":"milestones/M1_project_memo.md","sha256":"a0df579be3f460b17c872cfd15fc10938e1c7dda0d66b57586e760e35fd92908"},"created_at":"2026-07-26T00:00:00Z","diagnostic_only":false,"execution_status":"completed","findings":[],"legacy_execution_evidence":{"evidence":[{"byte_length":50,"path":"reviews/.harness/draft-governance/m1-initial-evaluation/non-graph-evidence.txt","sha256":"e8955d608e8c537dfd835bb9b37e713c449cfe15a1c47142f4f4b2a68ce60ab9"}],"rationale":"The fixture adapter executed; this does not substitute for its clean outcome.","status":"applied"},"obligation_id":"review-orchestration","outcome":"clean","policy":{"byte_length":32987,"path":"reviews/.harness/draft-governance/m1-initial-evaluation/contract.json","sha256":"33a6329b097ae178d727ac47ab296d4c023766440981e1524b477b4512713089"},"report":{"byte_length":654,"path":"reviews/.harness/obligation-reports/evaluation/review-orchestration.json","sha256":"e2b53e80c58cb0a41d5c888ba096ee9499da804b9a81bbbb76e93d549adf9cd1"},"schema_version":"1.0.0","verifier_receipt":{"byte_length":521,"path":"reviews/.harness/obligation-authority/obligation_verifier_authority-e27723023fd95a0e.json","sha256":"88fbe5c887d0f691d203bf0049d1cddb5e3ae2e35bf7c76e06493ae02d64c8e4"}}
