{"activation":"always","adapter_version":"1.0.0","adjudications":[],"artifact":{"byte_length":549,"path":"milestones/M1_project_memo.md","sha256":"a0df579be3f460b17c872cfd15fc10938e1c7dda0d66b57586e760e35fd92908"},"created_at":"2026-07-26T00:00:00Z","diagnostic_only":false,"execution_status":"completed","findings":[],"legacy_execution_evidence":{"evidence":[{"byte_length":50,"path":"reviews/.harness/draft-governance/m1-initial-generation/non-graph-evidence.txt","sha256":"e8955d608e8c537dfd835bb9b37e713c449cfe15a1c47142f4f4b2a68ce60ab9"}],"rationale":"The fixture adapter executed; this does not substitute for its clean outcome.","status":"applied"},"obligation_id":"citation-discipline","outcome":"clean","policy":{"byte_length":32990,"path":"reviews/.harness/draft-governance/m1-initial-generation/contract.json","sha256":"2ece1cb7d4d8505ed633a79ac4c08315fd5f2cb6b77bb7d83a7d2baaa7e722fb"},"report":{"byte_length":652,"path":"reviews/.harness/obligation-reports/generation/citation-discipline.json","sha256":"d8f63353d1e8f5db6595a68907e81a558824fa04968b38cefde021504da46718"},"schema_version":"1.0.0","verifier_receipt":{"byte_length":520,"path":"reviews/.harness/obligation-authority/obligation_verifier_authority-0816744f2e5c0f75.json","sha256":"0e1d22b88eca3805905f414366ef1309619d6bca6df8c807e6a7ae7da882a431"}}
