{"activation":"always","adapter_version":"1.0.0","adjudications":[],"artifact":{"byte_length":549,"path":"milestones/M1_project_memo.md","sha256":"a0df579be3f460b17c872cfd15fc10938e1c7dda0d66b57586e760e35fd92908"},"created_at":"2026-07-26T00:00:00Z","diagnostic_only":false,"execution_status":"completed","findings":[],"legacy_execution_evidence":{"evidence":[{"byte_length":50,"path":"reviews/.harness/draft-governance/m1-initial-evaluation/non-graph-evidence.txt","sha256":"e8955d608e8c537dfd835bb9b37e713c449cfe15a1c47142f4f4b2a68ce60ab9"}],"rationale":"The fixture adapter executed; this does not substitute for its clean outcome.","status":"applied"},"obligation_id":"integrated-style-checklist","outcome":"clean","policy":{"byte_length":32987,"path":"reviews/.harness/draft-governance/m1-initial-evaluation/contract.json","sha256":"33a6329b097ae178d727ac47ab296d4c023766440981e1524b477b4512713089"},"report":{"byte_length":666,"path":"reviews/.harness/obligation-reports/evaluation/integrated-style-checklist.json","sha256":"dc516be4740ea4611e17c1544a3d436aa4a83b0e75fc69ad5ca88a78da974090"},"schema_version":"1.0.0","verifier_receipt":{"byte_length":527,"path":"reviews/.harness/obligation-authority/obligation_verifier_authority-28a60bb291ef8eb4.json","sha256":"b44d1c59bc2bd295430d232fbacd5a39bbfea920ad05b97d40c122fd0e69629b"}}
