{"activation":"always","adapter_version":"1.0.0","adjudications":[],"artifact":{"byte_length":549,"path":"milestones/M1_project_memo.md","sha256":"a0df579be3f460b17c872cfd15fc10938e1c7dda0d66b57586e760e35fd92908"},"created_at":"2026-07-26T00:00:00Z","diagnostic_only":false,"execution_status":"completed","findings":[],"legacy_execution_evidence":{"evidence":[{"byte_length":50,"path":"reviews/.harness/draft-governance/m1-initial-generation/non-graph-evidence.txt","sha256":"e8955d608e8c537dfd835bb9b37e713c449cfe15a1c47142f4f4b2a68ce60ab9"}],"rationale":"The fixture adapter executed; this does not substitute for its clean outcome.","status":"applied"},"obligation_id":"grounding-protocol","outcome":"clean","policy":{"byte_length":32990,"path":"reviews/.harness/draft-governance/m1-initial-generation/contract.json","sha256":"2ece1cb7d4d8505ed633a79ac4c08315fd5f2cb6b77bb7d83a7d2baaa7e722fb"},"report":{"byte_length":650,"path":"reviews/.harness/obligation-reports/generation/grounding-protocol.json","sha256":"157e3aa6154fdb9804e20a0f5a4b938fb2bdbbc37bcdfb91b421aeb4a7f1e7b2"},"schema_version":"1.0.0","verifier_receipt":{"byte_length":519,"path":"reviews/.harness/obligation-authority/obligation_verifier_authority-eeb4de228f88116a.json","sha256":"6e9d9fec6efd625c43c5c0b0ad5d454c087be4c77df823cf9c56de43b15be81c"}}
