{"activation":"author_voice_present","adapter_version":"1.0.0","adjudications":[],"artifact":{"byte_length":549,"path":"milestones/M1_project_memo.md","sha256":"a0df579be3f460b17c872cfd15fc10938e1c7dda0d66b57586e760e35fd92908"},"created_at":"2026-07-26T00:00:00Z","diagnostic_only":false,"execution_status":"completed","findings":[],"legacy_execution_evidence":{"evidence":[{"byte_length":50,"path":"reviews/.harness/draft-governance/m1-initial-generation/non-graph-evidence.txt","sha256":"e8955d608e8c537dfd835bb9b37e713c449cfe15a1c47142f4f4b2a68ce60ab9"}],"rationale":"The fixture adapter executed; this does not substitute for its clean outcome.","status":"applied"},"obligation_id":"voice-preservation","outcome":"clean","policy":{"byte_length":32990,"path":"reviews/.harness/draft-governance/m1-initial-generation/contract.json","sha256":"2ece1cb7d4d8505ed633a79ac4c08315fd5f2cb6b77bb7d83a7d2baaa7e722fb"},"report":{"byte_length":664,"path":"reviews/.harness/obligation-reports/generation/voice-preservation.json","sha256":"f82ecc5ecc8a0321950e37e96053a2b3744d930a78686ab5b557b644021a61d0"},"schema_version":"1.0.0","verifier_receipt":{"byte_length":519,"path":"reviews/.harness/obligation-authority/obligation_verifier_authority-406be9b7c932a706.json","sha256":"5a30d91df11940f306810f5bb36951a73ea868243ed9ab0c79315f96b35ca92e"}}
