{"activation":"always","adapter_version":"1.0.0","adjudications":[],"artifact":{"byte_length":549,"path":"milestones/M1_project_memo.md","sha256":"a0df579be3f460b17c872cfd15fc10938e1c7dda0d66b57586e760e35fd92908"},"created_at":"2026-07-26T00:00:00Z","diagnostic_only":false,"execution_status":"completed","findings":[],"legacy_execution_evidence":{"evidence":[{"byte_length":50,"path":"reviews/.harness/draft-governance/m1-initial-generation/non-graph-evidence.txt","sha256":"e8955d608e8c537dfd835bb9b37e713c449cfe15a1c47142f4f4b2a68ce60ab9"}],"rationale":"The fixture adapter executed; this does not substitute for its clean outcome.","status":"applied"},"obligation_id":"dispatch-issuance-authority","outcome":"clean","policy":{"byte_length":32990,"path":"reviews/.harness/draft-governance/m1-initial-generation/contract.json","sha256":"2ece1cb7d4d8505ed633a79ac4c08315fd5f2cb6b77bb7d83a7d2baaa7e722fb"},"report":{"byte_length":668,"path":"reviews/.harness/obligation-reports/generation/dispatch-issuance-authority.json","sha256":"51e6e231f6d923164b5772811c723928bb96f1478fc047a8c41e45fe109a0710"},"schema_version":"1.0.0","verifier_receipt":{"byte_length":528,"path":"reviews/.harness/obligation-authority/obligation_verifier_authority-8026481e7b46e600.json","sha256":"6db7441985635444b4516e55620735af6e2f157e1d6279583b0e03a49df881a6"}}
